{
  "$schema": "https://claude.local/schemas/plugin.schema.json",
  "name": "claude-code-expert",
  "version": "7.6.0",
  "description": "High-intelligence Claude Code copilot with deep code reasoning, evidence-driven planning, orchestration-first execution, model routing, context budgeting, CI/CD integration, enterprise security, plugin development, prompt engineering, performance profiling, agent teams, channels (event-driven autonomy with CI webhook, mobile approval relay, Discord bridge, and fakechat dev profile), interactive tutorials, LSP integration, security-hardened hook script library, MCP Prompts coverage, common workflow packs, runtime selection guide, computer-use patterns, checkpointing, scheduled-task blueprints, repo bootstrap scanner, hook policy engine (8 installable packs), layered memory deployment, role-based subagent packs (implementer, debugger, migration-lead, dependency-auditor, release-coordinator), 5 agent-team topology kits, autonomy operating mode (4 profiles + 3 gates), and a queryable 15-tool MCP documentation server with autonomy advisor.",
  "author": {
    "name": "Markus Ahling"
  },
  "license": "MIT",
  "repository": "https://github.com/markus41/claude",
  "keywords": [
    "claude-code",
    "documentation",
    "configuration",
    "hooks",
    "mcp",
    "sdk",
    "cli",
    "ide",
    "best-practices",
    "debugger",
    "troubleshooting",
    "teams",
    "agent-teams",
    "subagents",
    "settings",
    "permissions",
    "security",
    "memory",
    "orchestration",
    "audit-loop",
    "agent-lifecycle",
    "context-anchoring",
    "research-routing",
    "self-healing",
    "cost-optimization",
    "council",
    "multi-agent-review",
    "deep-code-intelligence",
    "evidence-driven-planning",
    "repo-fingerprinting",
    "root-cause-analysis",
    "design-review",
    "ci-cd",
    "github-actions",
    "model-routing",
    "plugin-development",
    "prompt-engineering",
    "enterprise",
    "compliance",
    "tutorials",
    "performance-profiling",
    "context-budgeting",
    "session-analytics",
    "agentic-design-patterns",
    "prompt-chaining",
    "routing",
    "parallelization",
    "reflection",
    "planning",
    "multi-agent",
    "memory-management",
    "guardrails",
    "evaluation-monitoring",
    "a2a-communication",
    "resource-optimization",
    "reasoning-techniques",
    "channels",
    "mcp-channels",
    "webhooks",
    "permission-relay",
    "scheduled-tasks",
    "cron",
    "checkpointing",
    "rewind"
  ],
  "permissions": {
    "requires": [
      "read",
      "write",
      "bash"
    ],
    "optional": [
      "agent",
      "mcp",
      "network"
    ]
  },
  "capabilities": {
    "provides": [
      "claude-code-configuration",
      "multi-agent-orchestration",
      "deep-code-analysis",
      "repo-intelligence",
      "queryable-documentation",
      "debugging-and-self-healing",
      "ci-cd-integration",
      "model-routing",
      "enterprise-security",
      "plugin-development-guide",
      "session-analytics",
      "channels-event-streaming",
      "agent-teams-orchestration",
      "scheduled-tasks",
      "checkpointing"
    ],
    "requires": []
  },
  "contextEntry": "CONTEXT_SUMMARY.md",
  "context": {
    "entry": "CONTEXT_SUMMARY.md",
    "title": "Claude Code Expert",
    "summary": "Bootstrap context for a high-intelligence Claude Code expert plugin (v7.6.0) with 21 commands, 49 skills, 26 agents, and a 15-tool MCP server covering deep code reasoning, agentic design patterns, orchestration, CI/CD, enterprise security, model routing, context budgeting, LSP integration, hook script library, MCP Prompts, common workflow packs, runtime selection, computer-use patterns, checkpointing, scheduled-task blueprints, repo bootstrap scanner, autonomy operating mode (4 profiles + 3 gate agents), hook policy engine (8 packs), layered memory deployment, role-based subagent packs, 5 agent-team topology kits, autonomy advisor, and event-driven channels (CI webhook, mobile approval relay, Discord bridge, fakechat dev profile).",
    "tags": [
      "claude-code",
      "expert",
      "orchestration",
      "reasoning",
      "debugging",
      "mcp",
      "skills",
      "agents",
      "ci-cd",
      "enterprise",
      "tutorials"
    ],
    "bootstrapFiles": [
      "CONTEXT_SUMMARY.md"
    ],
    "maxTokens": 700,
    "excludeGlobs": [
      "**/node_modules/**",
      "**/dist/**",
      "**/build/**",
      "**/coverage/**",
      "**/*.zip",
      "**/*.tar*"
    ],
    "lazyLoadSections": [
      "CLAUDE.md",
      "skills/deep-code-intelligence/SKILL.md",
      "commands/cc-intel.md",
      "agents/principal-engineer-strategist.md",
      "skills/research-routing/SKILL.md",
      "skills/council-review/SKILL.md",
      "skills/model-routing/SKILL.md",
      "skills/prompt-engineering/SKILL.md",
      "skills/enterprise-security/SKILL.md",
      "commands/cc-budget.md",
      "commands/cc-cicd.md",
      "commands/cc-sync.md",
      "skills/channels/SKILL.md",
      "skills/channels-user-guide/SKILL.md",
      "skills/agent-teams/SKILL.md",
      "skills/scheduled-tasks/SKILL.md",
      "skills/checkpointing/SKILL.md",
      "skills/common-workflows/SKILL.md",
      "skills/runtime-selection/SKILL.md",
      "skills/computer-use/SKILL.md",
      "skills/lsp-integration/SKILL.md",
      "skills/hook-script-library/SKILL.md",
      "commands/cc-schedule.md",
      "commands/cc-bootstrap.md",
      "commands/cc-channels.md",
      "skills/channels-bootstrap/SKILL.md",
      "skills/hook-policy-engine/SKILL.md",
      "skills/agent-team-topologies/SKILL.md",
      "skills/autonomy-profiles/SKILL.md",
      "commands/cc-autonomy.md"
    ]
  }
}
